label,comment,author,subreddit,score,ups,downs,date,created_utc,parent_comment,text,error
1,"I'm glad you specified which part of the racket she used, I almost thought she put the other end in her vagina.",AIux_,tifu,15,15,0,2014-12,2014-12-14 18:49:44,"TIFU by telling my gf I was getting rid of an old tennis racket (NSFW) So this happened a little while ago, but i still cannot drive by a tennis court or sports store without remembering it. My gf asked me if I would be mad that she got a vibrator while I was sick because I didn't want to have sex while sick. I said sure, but I said she doesn't need to got some extremely expensive one or anything because its only for a little while. She took this to heart. Fast forward a few hours, I go to use the bathroom, and I see her sticking my brand new 200$ tennis racket (the grip part) inside her. I ask wtf she's doing, and she said that the store didn't have any thick ones, and she remembers that I told her I was getting rid of an old racket. She took the wrong racket, and being a student, I have no more money to buy the same racket again, because I saved up a while to get that one. Tl;Dr my gf used me brand new tennis racket for sexy time","TIFU by telling my gf I was getting rid of an old tennis racket (NSFW) So this happened a little while ago, but i still cannot drive by a tennis court or sports store without remembering it. My gf asked me if I would be mad that she got a vibrator while I was sick because I didn't want to have sex while sick. I said sure, but I said she doesn't need to got some extremely expensive one or anything because its only for a little while. She took this to heart. Fast forward a few hours, I go to use the bathroom, and I see her sticking my brand new 200$ tennis racket (the grip part) inside her. I ask wtf she's doing, and she said that the store didn't have any thick ones, and she remembers that I told her I was getting rid of an old racket. She took the wrong racket, and being a student, I have no more money to buy the same racket again, because I saved up a while to get that one. Tl;Dr my gf used me brand new tennis racket for sexy time[SEP]I'm glad you specified which part of the racket she used, I almost thought she put the other end in her vagina.",false_negative
1,"I'll keep my God, guns, and freedom, YOU can keep the change!",stiv2k,cringepics,-1,-1,0,2014-07,2014-07-08 20:19:43,I actually answer the phone that way sometimes. Just for a bit of change,"I actually answer the phone that way sometimes. Just for a bit of change[SEP]I'll keep my God, guns, and freedom, YOU can keep the change!",false_negative
1,Everyone on the hate gabe train,JordanTheToaster,pcmasterrace,1,1,0,2015-06,2015-06-04 23:15:27,Its kinda funny how everything went back to sucking Gaben's dick Isn't it?,Its kinda funny how everything went back to sucking Gaben's dick Isn't it?[SEP]Everyone on the hate gabe train,false_negative
1,don't worry we have shae mcclellin,Dank_Duck,CHIBears,10,10,0,2015-11,2015-11-24 14:35:26,Going to kind of put it in perspective. You saw how Peyton and that entire Denver team played against the Packers the night when Pat Bowlen got put into the Ring of Fame. That is the same situation the Bears are walking into at Lambeau on Thanksgiving. Favre's number is being retired of course but this is also the last time Bart Starr steps onto Lambeau field among several other Packers veterans. The only way the Packers don't come away with a win is if Aaron Rodgers has to be scraped up off the field.,Going to kind of put it in perspective. You saw how Peyton and that entire Denver team played against the Packers the night when Pat Bowlen got put into the Ring of Fame. That is the same situation the Bears are walking into at Lambeau on Thanksgiving. Favre's number is being retired of course but this is also the last time Bart Starr steps onto Lambeau field among several other Packers veterans. The only way the Packers don't come away with a win is if Aaron Rodgers has to be scraped up off the field.[SEP]don't worry we have shae mcclellin,false_negative
1,"My eyes are fine, I'm just not an art snob",Aenima420,Art,0,0,0,2016-02,2016-02-08 18:33:07,This is not even close to photo realism and is not good in the context of post modernist art. I recommend you get your eyes checked.,"This is not even close to photo realism and is not good in the context of post modernist art. I recommend you get your eyes checked.[SEP]My eyes are fine, I'm just not an art snob",false_negative
1,I love how easy the Mario games are now!,Bowlero,iphone,2,2,0,2016-09,2016-09-08 04:05:59,New Super Mario Run Gameplay,New Super Mario Run Gameplay[SEP]I love how easy the Mario games are now!,false_negative
1,"Yes, because code audits are usually done on the disassambly, because that is so much easier to read.",aaaaaaaarrrrrgh,technology,1,1,0,2013-08,2013-08-08 06:03:05,"Ya, the C would be impossible to read, but the asm callgraph would read the same no matter how you wrote it (assuming the flow remained the same).","Ya, the C would be impossible to read, but the asm callgraph would read the same no matter how you wrote it (assuming the flow remained the same).[SEP]Yes, because code audits are usually done on the disassambly, because that is so much easier to read.",false_negative
1,"But self-driving cars won't be able to drive on snow for at least 50 years, if ever",REOreddit,SelfDrivingCars,3,3,0,2016-01,2016-01-11 13:46:32,Ford testing driverless cars in snow,"Ford testing driverless cars in snow[SEP]But self-driving cars won't be able to drive on snow for at least 50 years, if ever",false_negative
1,Hey I think you dropped this,MerryBread,Overwatch,-4,-1,-1,2016-11,2016-11-21 18:38:17,"I think it's hilarious you kids talking crap about tim, u wouldnt say this shit to him irl, hes jacked. not only that but he wears the freshest clothes, eats at the chillest restaurants and hangs out with the hottest dudes. yall are pathetic lol.","I think it's hilarious you kids talking crap about tim, u wouldnt say this shit to him irl, hes jacked. not only that but he wears the freshest clothes, eats at the chillest restaurants and hangs out with the hottest dudes. yall are pathetic lol.[SEP]Hey I think you dropped this",false_negative
1,No.,HolySmit,RocketLeague,-8,-1,-1,2016-12,2016-12-08 13:04:52,Are rocket league servers down?,Are rocket league servers down?[SEP]No.,false_negative
1,It appears this is just so to make the challenge harder,KappaRoss_ruined,pathofexile,4,-1,-1,2016-10,2016-10-31 01:15:37,private video,private video[SEP]It appears this is just so to make the challenge harder,false_negative
1,Dont do pvp for a couple months... maybe you get to last?,R4ilTr4cer,SWGalaxyOfHeroes,1,1,0,2016-05,2016-05-31 06:27:15,Is there a way to tell how many players are on your shard? I kind of wonder this because if new player get set up in new shards what happens if enough people become inactive in an old shard? Does it not matter and you could find yourself only really playing with a handful of people?,Is there a way to tell how many players are on your shard? I kind of wonder this because if new player get set up in new shards what happens if enough people become inactive in an old shard? Does it not matter and you could find yourself only really playing with a handful of people?[SEP]Dont do pvp for a couple months... maybe you get to last?,false_negative
1,"Burritos, sandwiches, chili, pizza, tacos, burgers, soups, enchiladas, thai curry, chinese food, pad thai, ice cream, rice, pasta, wraps, salads, fruit, falafel, sushi, grape leaves, pakoras, samosas, mac &amp; cheese, chips, crackers, casseroles, pastries, cereals, cookies, candy, chickpea salad, swedish meatballs, cheesecake, mushrooms, buffalo wings, pancakes, waffles, couscous, hummus, bread, guacamole, chana masala, stir-fry ... Sounds awful",Omnibeneviolent,AskReddit,0,0,0,2016-02,2016-02-04 00:10:11,Have you seen what Vegans eat?,"Have you seen what Vegans eat?[SEP]Burritos, sandwiches, chili, pizza, tacos, burgers, soups, enchiladas, thai curry, chinese food, pad thai, ice cream, rice, pasta, wraps, salads, fruit, falafel, sushi, grape leaves, pakoras, samosas, mac &amp; cheese, chips, crackers, casseroles, pastries, cereals, cookies, candy, chickpea salad, swedish meatballs, cheesecake, mushrooms, buffalo wings, pancakes, waffles, couscous, hummus, bread, guacamole, chana masala, stir-fry ... Sounds awful",false_negative
1,"What, you don't want WW2 scale combat with modern conventional weapons?",Ronkerjake,worldnews,2,-1,-1,2016-10,2016-10-09 11:29:01,"Missile protection has the potential to break MAD, and that is something you seriously don't want. Think about it.","Missile protection has the potential to break MAD, and that is something you seriously don't want. Think about it.[SEP]What, you don't want WW2 scale combat with modern conventional weapons?",false_negative
1,What if we are all just waiting for someone to confirm that the EU wave has begun and nobody is checking?,Noisetalgia_,Overwatch,1,1,0,2016-04,2016-04-15 01:17:29,Looking like it hasn't started yet. Not a single EU post yet.,Looking like it hasn't started yet. Not a single EU post yet.[SEP]What if we are all just waiting for someone to confirm that the EU wave has begun and nobody is checking?,false_negative
1,"Because the fact that you can only explore a minuscule fraction of Anor londo (which lore wise is a gigantic city, and is nicely shown as a skybox) is not game-like.",hey_aaapple,DarkSouls2,1,1,0,2014-09,2014-09-29 10:03:21,"Well, to me it feels like dark souls 2 was built more like a game, like, comparing Drangleic Castle to Anor Londo; Drangleic Castle is a linear level filled with strange traps that don't really fit (poison mask room, ruin sentinels hidden in that way) while the part of Anor Londo after the archers seems like a place where people actually lived, with bedrooms, and rooms where people would pray, and while silver knights were guarding it, they weren't just shoved tightly into every room in the castle. Also, there was deeper stuff, like Havel's secret chamber, with his armour and his secret occult club made to harm gods. I will admit that the cathedral rafters were kind of like the Dark Souls 2 level design, but the archers were fine.","Well, to me it feels like dark souls 2 was built more like a game, like, comparing Drangleic Castle to Anor Londo; Drangleic Castle is a linear level filled with strange traps that don't really fit (poison mask room, ruin sentinels hidden in that way) while the part of Anor Londo after the archers seems like a place where people actually lived, with bedrooms, and rooms where people would pray, and while silver knights were guarding it, they weren't just shoved tightly into every room in the castle. Also, there was deeper stuff, like Havel's secret chamber, with his armour and his secret occult club made to harm gods. I will admit that the cathedral rafters were kind of like the Dark Souls 2 level design, but the archers were fine.[SEP]Because the fact that you can only explore a minuscule fraction of Anor londo (which lore wise is a gigantic city, and is nicely shown as a skybox) is not game-like.",false_negative
1,She is to be executed in the morning after a hearty breakfast and a smoke.,heezeydeezay,AskReddit,7,7,0,2016-08,2016-08-10 15:32:59,So? Is she deep in trouble already? WE NEED ANSWERS.,So? Is she deep in trouble already? WE NEED ANSWERS.[SEP]She is to be executed in the morning after a hearty breakfast and a smoke.,false_negative
1,They probably thought it was fine because she was there when the account was open (but she is not on it)and she's my mom what could be the problem?,poniesridingdragons,raisedbynarcissists,8,8,0,2015-10,2015-10-11 06:08:11,"Uhhhh okay I have no idea if this is factual but that sure doesn't sound legal. You are a grown ass adult, you could probably sue them for that. Unless her name was still somehow on the account, they definitely can't just divulge information willy nilly. You should definitely take it up with them.","Uhhhh okay I have no idea if this is factual but that sure doesn't sound legal. You are a grown ass adult, you could probably sue them for that. Unless her name was still somehow on the account, they definitely can't just divulge information willy nilly. You should definitely take it up with them.[SEP]They probably thought it was fine because she was there when the account was open (but she is not on it)and she's my mom what could be the problem?",false_negative
1,"Have fun, though I think you could run a 960 off of a AA battery.",SASSN1PER,pcmasterrace,-2,-2,0,2015-03,2015-03-20 04:00:13,Ascension is upon me (waiting for PSU to arrive),"Ascension is upon me (waiting for PSU to arrive)[SEP]Have fun, though I think you could run a 960 off of a AA battery.",false_negative
1,At least they left a service loop.,hmchief,OSHA,30,30,0,2016-09,2016-09-20 15:13:17,Is this up to code?,Is this up to code?[SEP]At least they left a service loop.,false_negative
1,As a Southern Louisianan... Yes,TheObnoxiousCamoToe,Showerthoughts,1,1,0,2016-03,2016-03-27 16:13:46,Is it bad that I don't need the subtitles to watch that show?,Is it bad that I don't need the subtitles to watch that show?[SEP]As a Southern Louisianan... Yes,false_negative
1,went really well,Me4rts,IreliaMains,3,3,0,2016-09,2016-09-30 04:55:05,"Irelia currently in worlds Just a quick update, for those who want to see pro irelia gameplay, check out worlds (ITZ vs. EDG; Irelia vs. Gnar)","Irelia currently in worlds Just a quick update, for those who want to see pro irelia gameplay, check out worlds (ITZ vs. EDG; Irelia vs. Gnar)[SEP]went really well",false_negative
1,.5 maybe .6,NugsOnTheNightstand,trees,1,1,0,2015-10,2015-10-13 19:54:58,Dam dude! How much is that? 2-3 oz?,Dam dude! How much is that? 2-3 oz?[SEP].5 maybe .6,false_negative
1,Umm... Ok... That's normal isn't it?,Rustii87,GlobalOffensive,1,1,0,2015-12,2015-12-10 09:19:30,Insane 1 tap through triple box with TEC-9,Insane 1 tap through triple box with TEC-9[SEP]Umm... Ok... That's normal isn't it?,false_negative
1,Joke ruined!,NewAccAfter9Years,Unexpected,-1,-1,0,2016-09,2016-09-17 00:42:11,"Not going to lie, could tell right away that the cooked bird was a chicken, not a duck. Duck drumsticks aren't that big XD","Not going to lie, could tell right away that the cooked bird was a chicken, not a duck. Duck drumsticks aren't that big XD[SEP]Joke ruined!",false_negative
1,Would be more impressive than Leicester winning the PL,franbatista123,soccer,10,10,0,2016-09,2016-09-08 20:02:35,Ranieri: Liverpool are my favorite to win the Premier League,Ranieri: Liverpool are my favorite to win the Premier League[SEP]Would be more impressive than Leicester winning the PL,false_negative
1,Some call it poison,JacksLackOfSuprise,AskReddit,2,2,0,2016-01,2016-01-29 13:10:57,"But you don't have to milk them to get the milk out. On the other hand, you DO milk a snake, but what comes out is never called milk. It's always called venom.","But you don't have to milk them to get the milk out. On the other hand, you DO milk a snake, but what comes out is never called milk. It's always called venom.[SEP]Some call it poison",false_negative
1,I was about to answer but i realized that i have to go to sleep because i need to build a wall tomorrow .,Smoking_Trees,GlobalOffensive,3,-1,-1,2016-11,2016-11-09 10:45:13,Will Trump's presidency have a big effect on player visas,Will Trump's presidency have a big effect on player visas[SEP]I was about to answer but i realized that i have to go to sleep because i need to build a wall tomorrow .,false_negative
1,Somebody has to *manage* the McDonald's,semnotimos,todayilearned,7,7,0,2016-08,2016-08-02 00:48:28,"TIL that each year, there are more than 35,000 low-income high school seniors that score in the 90th percentile on the ACT or SAT but never make it to college.","TIL that each year, there are more than 35,000 low-income high school seniors that score in the 90th percentile on the ACT or SAT but never make it to college.[SEP]Somebody has to *manage* the McDonald's",false_negative
1,"Literally the amount of pulls i did last year and i didnt get her Have you been stalking me, OP?",TurroDeRecoleta,bravefrontier,3,-1,-1,2016-12,2016-12-15 13:28:41,Zeruiah is coming to town,"Zeruiah is coming to town[SEP]Literally the amount of pulls i did last year and i didnt get her Have you been stalking me, OP?",false_negative
1,"Walking around town with your lady in full battle armour, and dueling who ever is so foolish to attempt to court her.",Crown118,AskReddit,2,2,0,2015-01,2015-01-10 22:05:50,Which fashion trend would you like to see come back in style in 2015?,"Which fashion trend would you like to see come back in style in 2015?[SEP]Walking around town with your lady in full battle armour, and dueling who ever is so foolish to attempt to court her.",false_negative
1,that explains where the weirdos come from.......,AndyJekal,AskReddit,1,1,0,2016-06,2016-06-28 04:53:53,I'm fully aware. I have lots of family out there,I'm fully aware. I have lots of family out there[SEP]that explains where the weirdos come from.......,false_negative
1,Glitches in the matrix?,adbJ114,AskReddit,1,-1,-1,2016-10,2016-10-24 22:21:09,"The Matrix: 1. When Agent Smith is interrogating Thomas Anderson/Neo, there's one shot that was a closeup of the binder of his profile/record, with no pages turned over. In the next shot, there they're halfway through the binder. 2. When he's standing on the edge of the building after going out the window per Morpheus' orders and loses the phone, a parade is marching down the street. In the next shot, that same street is empty. 3. When Neo receives the Fed-Ex package that contained the cell phone from Morpheus, a crew member's hand can be seen in the background, on a stack of papers. 4. When Neo first meets Morpheus, he (Laurence Fishburne/Morpheus) has both his hands behind his back. He keeps his left hand behind his back as he offers his right hand to Neo. In the next shot, which shows Morpheus from the front, his left hand is by his side. When it cuts back to behind Morpheus, the left hand is behind his back again. 5. When Neo visits the Oracle, she's carrying a tray of only four cookies. When she offers him a cookie, and it shows a closeup of the tray, there are six cookies. 6. When Neo is on the rooftop with one of the Agents, he drops his guns. When the Agent shoots at him, the guns disappear, then reappear as he attempts to dodge the bullets.","The Matrix: 1. When Agent Smith is interrogating Thomas Anderson/Neo, there's one shot that was a closeup of the binder of his profile/record, with no pages turned over. In the next shot, there they're halfway through the binder. 2. When he's standing on the edge of the building after going out the window per Morpheus' orders and loses the phone, a parade is marching down the street. In the next shot, that same street is empty. 3. When Neo receives the Fed-Ex package that contained the cell phone from Morpheus, a crew member's hand can be seen in the background, on a stack of papers. 4. When Neo first meets Morpheus, he (Laurence Fishburne/Morpheus) has both his hands behind his back. He keeps his left hand behind his back as he offers his right hand to Neo. In the next shot, which shows Morpheus from the front, his left hand is by his side. When it cuts back to behind Morpheus, the left hand is behind his back again. 5. When Neo visits the Oracle, she's carrying a tray of only four cookies. When she offers him a cookie, and it shows a closeup of the tray, there are six cookies. 6. When Neo is on the rooftop with one of the Agents, he drops his guns. When the Agent shoots at him, the guns disappear, then reappear as he attempts to dodge the bullets.[SEP]Glitches in the matrix?",false_negative
1,Idk what it is ever since 6.20 I've been rocking a 75% win rate on her... Something must have finally clicked,Zoltron963,Rivenmains,1,-1,-1,2016-10,2016-10-11 13:33:35,"Uhm... was this patch 6.20? Her combo got easier :P Enjoy the satisfaction while its easy, and if you really liked it, master the actual combos :D","Uhm... was this patch 6.20? Her combo got easier :P Enjoy the satisfaction while its easy, and if you really liked it, master the actual combos :D[SEP]Idk what it is ever since 6.20 I've been rocking a 75% win rate on her... Something must have finally clicked",false_negative
1,Even Trevor's actor [is a hipster!],PneumaticPtarmigan,GrandTheftAutoV,36,36,0,2013-10,2013-10-08 23:24:12,"is it me or do they all look about 100x ""trendier"" than they did in the last picture that made the front page?","is it me or do they all look about 100x ""trendier"" than they did in the last picture that made the front page?[SEP]Even Trevor's actor [is a hipster!]",false_negative
1,Ah come on Roman Will was a beast,Kysis,ColoradoAvalanche,1,1,0,2016-05,2016-05-19 17:41:43,Honestly of that lot the only one I really care about right now is Picks ...,Honestly of that lot the only one I really care about right now is Picks ...[SEP]Ah come on Roman Will was a beast,false_negative
1,I'd like some proof that Jatt's statement isn't being made under duress.,herptydurr,leagueoflegends,1,1,0,2016-09,2016-09-02 01:14:03,"Jatt Addresses the ""Jatt or Monte?"" Question","Jatt Addresses the ""Jatt or Monte?"" Question[SEP]I'd like some proof that Jatt's statement isn't being made under duress.",false_negative
1,"Like cougars, but they come out your nose.",GustavoFrings,AskReddit,1,1,0,2014-09,2014-09-09 23:36:01,What are bougars?,"What are bougars?[SEP]Like cougars, but they come out your nose.",false_negative
1,"0/10 it is not ""Anima"" type",Hyouzen,bravefrontier,1,1,0,2016-05,2016-05-03 04:16:34,Tfw RNG is nice to you...,"Tfw RNG is nice to you...[SEP]0/10 it is not ""Anima"" type",false_negative
1,Thank god I nearly had a heart attack.,alucard2122,pcmasterrace,1,1,0,2016-01,2016-01-13 07:50:11,"Haven't finished yet, waiting for PSU to arrive and then once everything is in, I can grab ALL of the Cable ties in the world.","Haven't finished yet, waiting for PSU to arrive and then once everything is in, I can grab ALL of the Cable ties in the world.[SEP]Thank god I nearly had a heart attack.",false_negative
1,WHAT A VALUE!,chinamanbilly,Bushwick,2,2,0,2016-05,2016-05-31 19:54:29,"Room For Rent in Bushwick, Brooklyn, NY - we are a family looking to rent a room to a single person, couple, or another family.","Room For Rent in Bushwick, Brooklyn, NY - we are a family looking to rent a room to a single person, couple, or another family.[SEP]WHAT A VALUE!",false_negative
1,Well... What could possibly go wrong?,Theosaur,AskReddit,1,1,0,2015-07,2015-07-28 20:56:38,"It's like our bodies are telling us *not* to eat an 11,000 calorie cake. Well fuck you body! You're not the boss of me!","It's like our bodies are telling us *not* to eat an 11,000 calorie cake. Well fuck you body! You're not the boss of me![SEP]Well... What could possibly go wrong?",false_negative
