label,comment,author,subreddit,score,ups,downs,date,created_utc,parent_comment,text,error
1,It doesn't even have a gut wrenching story about how terrible the TL mods are...,vetiton,starcraft,-2,-2,0,2014-01,2014-01-11 00:56:06,"""TL pls fix"" on reddit, cosue you know they do not have their own forum","""TL pls fix"" on reddit, cosue you know they do not have their own forum[SEP]It doesn't even have a gut wrenching story about how terrible the TL mods are...",false_negative
1,You are the worst kind of player.,ultimateF_21,nfl,0,0,0,2013-09,2013-09-06 05:05:56,"nah, they stopped passing at the end. if this was **my** madden, Peyton would have broken the record with several more TDs, mainly from running slot posts and slants.","nah, they stopped passing at the end. if this was **my** madden, Peyton would have broken the record with several more TDs, mainly from running slot posts and slants.[SEP]You are the worst kind of player.",false_negative
1,The anti-spam automoderator sure works well on that subreddit.,VibriMusicRabbit,linuxmasterrace,3,3,0,2016-09,2016-09-05 22:16:29,Meanwhile on r/Windows10,Meanwhile on r/Windows10[SEP]The anti-spam automoderator sure works well on that subreddit.,false_negative
1,"Those vanilla WoW lvl 60's are really ripping it up still, wait no lvl 70's, wait no 80's, wait no 90?",alphadog6969,elderscrollsonline,1,1,0,2014-05,2014-05-06 22:05:02,thank you for making me feel better about canceling my sub. constant vertical 'progression' is lame. Ever notice that leveling up is the same as if your gear was down leveled?,"thank you for making me feel better about canceling my sub. constant vertical 'progression' is lame. Ever notice that leveling up is the same as if your gear was down leveled?[SEP]Those vanilla WoW lvl 60's are really ripping it up still, wait no lvl 70's, wait no 80's, wait no 90?",false_negative
1,"If you're going to troll, try to be a little less subtle about it, why don't you?",-halcyon,australia,1,1,0,2013-11,2013-11-25 09:08:01,While they're at it they should probably change the name of family planning clinics to baby murder centres.,"While they're at it they should probably change the name of family planning clinics to baby murder centres.[SEP]If you're going to troll, try to be a little less subtle about it, why don't you?",false_negative
1,"Whatever, that game is a classic before the first line of code was written.",campelm,xboxone,111,111,0,2016-03,2016-03-08 13:33:48,you mean like the 11000+ ratings on Gears 4,"you mean like the 11000+ ratings on Gears 4[SEP]Whatever, that game is a classic before the first line of code was written.",false_negative
1,so JDM its even right hand drive!,soccersalah,Stance,3,3,0,2016-01,2016-01-25 07:28:49,neither snow nor rain nor heat nor gloom of night,neither snow nor rain nor heat nor gloom of night[SEP]so JDM its even right hand drive!,false_negative
1,"Wow, you hit OP?",bic_man,bicycling,9,9,0,2016-07,2016-07-23 03:39:42,Sorry man.,"Sorry man.[SEP]Wow, you hit OP?",false_negative
1,Money,Jakeola1,AskReddit,1,1,0,2015-03,2015-03-29 07:14:49,"What is a song from a pink floyd album that you think is good, yet no one knows about? Or any other band similar to pink floyd!","What is a song from a pink floyd album that you think is good, yet no one knows about? Or any other band similar to pink floyd![SEP]Money",false_negative
1,DeadPool?,ChocoboTorchicKid,marvelstudios,1,1,0,2016-03,2016-03-26 03:31:55,Please don't use DP this way again. My internet brain wasn't ready...,Please don't use DP this way again. My internet brain wasn't ready...[SEP]DeadPool?,false_negative
1,*Official* leaflets.,Cheimon,unitedkingdom,5,5,0,2013-03,2013-03-08 20:16:25,"No it wasn't, it was a volunteer...A random guy dropping leaflets off at houses.","No it wasn't, it was a volunteer...A random guy dropping leaflets off at houses.[SEP]*Official* leaflets.",false_negative
1,This is so current.,KevinAlligators,gaming,1,1,0,2011-11,2011-11-22 01:19:03,Aeris revived in FF7,Aeris revived in FF7[SEP]This is so current.,false_negative
1,"It was on one of the Bounty Hunters Class missions: [**Spoilers**] : [In one mission you get sent back to DK to kill a beast in a cave, and if you go to the back of the cave there is all of this mist/fog there which allowed me to take this screenshot!]",Tyrexx_Lannister,swtor,1,1,0,2015-09,2015-09-11 13:57:50,Really like the third picture! How'd you manage that?,"Really like the third picture! How'd you manage that?[SEP]It was on one of the Bounty Hunters Class missions: [**Spoilers**] : [In one mission you get sent back to DK to kill a beast in a cave, and if you go to the back of the cave there is all of this mist/fog there which allowed me to take this screenshot!]",false_negative
1,Well it is perfectly understandable to not have noticed the eighteen wheeler hurtling down the road they are very sneaky,LUG1,nononono,1,1,0,2016-04,2016-04-23 01:53:47,Dumbass turns without even looking..,Dumbass turns without even looking..[SEP]Well it is perfectly understandable to not have noticed the eighteen wheeler hurtling down the road they are very sneaky,false_negative
1,Totally chatting,Gaythrowaway1823,MtvChallenge,3,3,0,2016-06,2016-06-23 07:08:15,He physically pinned her there? Or were they just chatting/arguing? I feel like Camila would have done something if she felt trapped/in danger.,He physically pinned her there? Or were they just chatting/arguing? I feel like Camila would have done something if she felt trapped/in danger.[SEP]Totally chatting,false_negative
1,"Excellent, I have always wanted to pay $20,000 for basic medical procedures",Eltimar,Calgary,10,10,0,2015-03,2015-03-14 21:52:04,Should Alberta join the US?,"Should Alberta join the US?[SEP]Excellent, I have always wanted to pay $20,000 for basic medical procedures",false_negative
1,Suddenly you realize people are crazy.,Retanaru,politics,1,1,0,2011-08,2011-08-02 18:53:21,"The revival of myths about stable slave families is not a harmless gaffe, but a sign of deliberate amnesia.","The revival of myths about stable slave families is not a harmless gaffe, but a sign of deliberate amnesia.[SEP]Suddenly you realize people are crazy.",false_negative
1,That's not terrifying at all...,RunJohnnyRun,politics,7,7,0,2015-12,2015-12-09 16:15:48,Trump has actually spoken very kindly of Putin. He seems to look to Putin as a role model.,Trump has actually spoken very kindly of Putin. He seems to look to Putin as a role model.[SEP]That's not terrifying at all...,false_negative
1,"I too am waiting for the Orange update, and looking awfully forward to Oranges amazing apps that I use all the time",Skilbride,Android,1,1,0,2012-04,2012-04-12 11:12:59,"Son of a bitch, I wish Orange would hurry the hell up. Exactly how long does it take to slap some branded shovelware on there anyway...","Son of a bitch, I wish Orange would hurry the hell up. Exactly how long does it take to slap some branded shovelware on there anyway...[SEP]I too am waiting for the Orange update, and looking awfully forward to Oranges amazing apps that I use all the time",false_negative
1,"Gosh, why can't you instantly recognize the language and connection to the title like everyone else?",Corfal,ProgrammerHumor,3,3,0,2015-06,2015-06-25 04:41:02,"I later saw that this is a summary of unit testing, but at first, I saw multiple threads trying to print something like ""OPERATION NOT THREADSA*FE.*"" at once. If `println` isn't threadsafe in your language, it'll look like that sometimes.","I later saw that this is a summary of unit testing, but at first, I saw multiple threads trying to print something like ""OPERATION NOT THREADSA*FE.*"" at once. If `println` isn't threadsafe in your language, it'll look like that sometimes.[SEP]Gosh, why can't you instantly recognize the language and connection to the title like everyone else?",false_negative
1,Do you mean the double stacks?,zalithed,AirForce,2,2,0,2016-09,2016-09-10 14:58:56,They just moved a lot of the aircrew to the chicken coops thankfully. Do not miss trying to sleep through shitty cover bands,They just moved a lot of the aircrew to the chicken coops thankfully. Do not miss trying to sleep through shitty cover bands[SEP]Do you mean the double stacks?,false_negative
1,"I agree, I wonder if people think i'm scripting when I play Ali now",Bl1ndz,leagueoflegends,1,1,0,2015-07,2015-07-10 00:55:01,You mean W + Q ? Quite easy when you know how to do it.,"You mean W + Q ? Quite easy when you know how to do it.[SEP]I agree, I wonder if people think i'm scripting when I play Ali now",false_negative
1,"Wow, this could never be tampered with!",FriendzonedByHitler,The_Donald,1,1,0,2016-06,2016-06-23 22:23:45,"Wish us god's speed fellow centipedes, time to reverse globalism.","Wish us god's speed fellow centipedes, time to reverse globalism.[SEP]Wow, this could never be tampered with!",false_negative
1,It's a synonym of playground,BastPriestess,childfree,3,3,0,2015-06,2015-06-06 01:37:58,"How is this possibly *new*? Wtf does ""bar"" mean?","How is this possibly *new*? Wtf does ""bar"" mean?[SEP]It's a synonym of playground",false_negative
1,It died when Clapton plugged in,shorthanded,Guitar,8,8,0,2015-11,2015-11-29 18:16:54,What you don't like stratocousters? Where's your sense of novelty and childhood sense of fun?,What you don't like stratocousters? Where's your sense of novelty and childhood sense of fun?[SEP]It died when Clapton plugged in,false_negative
1,I just hope he doesn't get an eye infection like carrick,shnieder88,reddevils,7,7,0,2013-08,2013-08-14 22:29:59,"Welbeck had been a different player in the second half. He looks great right now, but in the first half he looked scared to me. Looked as if he was happier passing the ball away than taking a chance. But second half Welbeck looks like he's it fire in his eyes.","Welbeck had been a different player in the second half. He looks great right now, but in the first half he looked scared to me. Looked as if he was happier passing the ball away than taking a chance. But second half Welbeck looks like he's it fire in his eyes.[SEP]I just hope he doesn't get an eye infection like carrick",false_negative
1,But spending several orders of magnitude more on warfare is perfectly reasonable.,aliendude5300,politics,1,1,0,2014-03,2014-03-06 01:54:37,"Obama seeks a $5-billion boost for science: Proposal unlikely to win support of Congress, dashing hopes for a funding increase.","Obama seeks a $5-billion boost for science: Proposal unlikely to win support of Congress, dashing hopes for a funding increase.[SEP]But spending several orders of magnitude more on warfare is perfectly reasonable.",false_negative
1,i learned this cool trick to make my dick grow 4 inches in 4 weeks....,crazywhiteboy1,AskReddit,1,1,0,2013-04,2013-04-15 03:11:55,I learned this one cool trick and lost 40 pounds!,I learned this one cool trick and lost 40 pounds![SEP]i learned this cool trick to make my dick grow 4 inches in 4 weeks....,false_negative
1,Really made me think,shade444,worldnews,-2,-2,0,2016-07,2016-07-28 13:26:03,And that's why they call themselves nationalists.,And that's why they call themselves nationalists.[SEP]Really made me think,false_negative
1,Didn't see the dog till I finished.,zionvinman,ConfusedBoners,12,12,0,2014-12,2014-12-02 05:07:02,The alignment is flawless,The alignment is flawless[SEP]Didn't see the dog till I finished.,false_negative
1,Surprised it's a Phantom!,somerandomguy03,Multicopter,43,43,0,2015-11,2015-11-04 15:34:03,Saw this idiot at the UT NIU game flying over fans,Saw this idiot at the UT NIU game flying over fans[SEP]Surprised it's a Phantom!,false_negative
1,All Is Within,TheTruckWashChannel,Monstercat,5,5,0,2015-10,2015-10-08 20:48:44,"Any Cancelled EP's, Singles, or Albums on Monstercat? The only one I know is the Run Away From Me Remixes.","Any Cancelled EP's, Singles, or Albums on Monstercat? The only one I know is the Run Away From Me Remixes.[SEP]All Is Within",false_negative
1,The CW.,TowerBeast,news,13,13,0,2013-03,2013-03-02 01:59:13,***WHOSE***,***WHOSE***[SEP]The CW.,false_negative
1,Always late with my packages.,cheesetaco6926,ProtectAndServe,4,4,0,2014-12,2014-12-19 23:08:29,How do you feel about the UPS union?,How do you feel about the UPS union?[SEP]Always late with my packages.,false_negative
1,"No way man, that's the richness",topsham134,Scotch,1,-1,-1,2016-10,2016-10-01 23:09:39,Good god that looks like they went to town on the e150!,"Good god that looks like they went to town on the e150![SEP]No way man, that's the richness",false_negative
1,We need to start the purge night... Thin the herd a bit lol,Thelatedrpepper,houston,3,3,0,2016-04,2016-04-12 19:08:49,HPD: Son shot dead while protecting mom from purse thief,HPD: Son shot dead while protecting mom from purse thief[SEP]We need to start the purge night... Thin the herd a bit lol,false_negative
1,Probably similar to why cars cost less in Wetaskiwin,platypus45,Edmonton,0,0,0,2015-09,2015-09-21 02:36:05,Why are used cars cheaper in Calgary?,Why are used cars cheaper in Calgary?[SEP]Probably similar to why cars cost less in Wetaskiwin,false_negative
1,Pretty sure you mean Stallone,Mutoid,gaming,3,3,0,2014-12,2014-12-01 18:23:39,I imagined Dredd's lines with the voice of Diedrich Bader. So fitting.,I imagined Dredd's lines with the voice of Diedrich Bader. So fitting.[SEP]Pretty sure you mean Stallone,false_negative
1,"Except your independence, I guess.",norway_is_awesome,europe,11,11,0,2015-08,2015-08-14 23:03:15,Merda in catalan! We like changing things I guess,"Merda in catalan! We like changing things I guess[SEP]Except your independence, I guess.",false_negative
1,Oh no you didn't just talk shit bout my nigga Mike Ross,kappacop,Kappa,2,2,0,2014-04,2014-04-22 19:36:02,"The way some of y'all talk shit about these players, I should start talking about shitty posts like this one.","The way some of y'all talk shit about these players, I should start talking about shitty posts like this one.[SEP]Oh no you didn't just talk shit bout my nigga Mike Ross",false_negative
1,"Oh, well in that case never mind.",fuck_bestbuy,funny,2,2,0,2015-09,2015-09-26 04:11:22,Most actors I know refer to themselves as actors.,"Most actors I know refer to themselves as actors.[SEP]Oh, well in that case never mind.",false_negative
1,Special characters are dangerous though,Crecket,shittyprogramming,6,6,0,2016-01,2016-01-25 02:32:20,"I assume they are referring to where it says 6-10 characters, no special characters allowed.","I assume they are referring to where it says 6-10 characters, no special characters allowed.[SEP]Special characters are dangerous though",false_negative
1,You have caused my dragon balls to summon Shenron.,Samstarr,dbz,1,1,0,2014-12,2014-12-02 20:55:29,"I know its dragon ball, not dbz, but I thought you'd appreciate my new underwear","I know its dragon ball, not dbz, but I thought you'd appreciate my new underwear[SEP]You have caused my dragon balls to summon Shenron.",false_negative
1,Yeah it's gettin' to the point where a grown man can't walk down the street without some sexy little 3 year old sashayin' up to him and just vampin' on him like he was some sort of irresistible chick magnet or somethin'!,Gaggamaggot,NewsOfTheStupid,3,3,0,2014-05,2014-05-25 02:38:02,"Man claimed toddler initiated sex contact, gets prison","Man claimed toddler initiated sex contact, gets prison[SEP]Yeah it's gettin' to the point where a grown man can't walk down the street without some sexy little 3 year old sashayin' up to him and just vampin' on him like he was some sort of irresistible chick magnet or somethin'!",false_negative
1,Hang ingat hang mat salleh ka nyanyi lagu ongputeh?,shytake,malaysia,2,2,0,2016-07,2016-07-22 03:44:25,The biggest discrimination was from my own race - Yuna (A response to the reaction to her Usherhug),The biggest discrimination was from my own race - Yuna (A response to the reaction to her Usherhug)[SEP]Hang ingat hang mat salleh ka nyanyi lagu ongputeh?,false_negative
1,But the drawer wasn't marked with Stephanie's name,Upallnight88,relationships,6,6,0,2015-02,2015-02-24 02:25:52,"The plate thing is bizarre. OP used a roommates plate, having been told not to use their roommates plate before. They're explicitly reminded of this... And then they proceed to continue using the plate and store it in their fridge with food on it rather than swapping the food over and washing the plate then and there. Hell, I'd be pissed if I told my roommates not to use my plates, and then find out that they've not only used one of my plates, but they're keeping it in their fridge.","The plate thing is bizarre. OP used a roommates plate, having been told not to use their roommates plate before. They're explicitly reminded of this... And then they proceed to continue using the plate and store it in their fridge with food on it rather than swapping the food over and washing the plate then and there. Hell, I'd be pissed if I told my roommates not to use my plates, and then find out that they've not only used one of my plates, but they're keeping it in their fridge.[SEP]But the drawer wasn't marked with Stephanie's name",false_negative
1,"Oh man, that is gonna land you 30 years in prison!",ThePrettyMiserable,CasualConversation,2,2,0,2015-11,2015-11-11 16:41:08,Should I be worried?,"Should I be worried?[SEP]Oh man, that is gonna land you 30 years in prison!",false_negative
1,"yeah, lets define web-standards using IE-filters... i don't want to use gradients this way: background-image: linear-gradient(to bottom, rgba(255,222,0,1) 0%, rgba(255,222,0,0) 100%); i would rather write: filter: progid:DXImageTransform.Microsoft.gradient( startColorstr='#ffde00', endColorstr='#00ffde00',GradientType=0 ); it's much easier easier to understand, and because of the 'gradienttype=0' i don't even have to look up the meaning of 'to bottom' ^^^^^^",el_kaweh,AskReddit,25,25,0,2014-02,2014-02-01 14:07:04,"That's because IE simply requires a whole set of adjustments for it to read standard CSS, and before IE7 it couldn't do really, really basic things that are absolutely appalling. It's a bit better now. But yeah if a site has its style designed only with the set of rules for IE, then other browsers are gonna have trouble.","That's because IE simply requires a whole set of adjustments for it to read standard CSS, and before IE7 it couldn't do really, really basic things that are absolutely appalling. It's a bit better now. But yeah if a site has its style designed only with the set of rules for IE, then other browsers are gonna have trouble.[SEP]yeah, lets define web-standards using IE-filters... i don't want to use gradients this way: background-image: linear-gradient(to bottom, rgba(255,222,0,1) 0%, rgba(255,222,0,0) 100%); i would rather write: filter: progid:DXImageTransform.Microsoft.gradient( startColorstr='#ffde00', endColorstr='#00ffde00',GradientType=0 ); it's much easier easier to understand, and because of the 'gradienttype=0' i don't even have to look up the meaning of 'to bottom' ^^^^^^",false_negative
1,"Fake, there is no atmosphere for planes to fly in on the moon.",baudouin_roullier,pics,1,1,0,2015-06,2015-06-02 23:27:24,My father took a picture of the moon. Got a lucky shot of a plane going by.,"My father took a picture of the moon. Got a lucky shot of a plane going by.[SEP]Fake, there is no atmosphere for planes to fly in on the moon.",false_negative
1,"It's ok, in my headcanon she was baking you a cake.",AManAlone,AskMen,0,0,0,2014-08,2014-08-20 15:05:55,"You characterized me nicely, well done.","You characterized me nicely, well done.[SEP]It's ok, in my headcanon she was baking you a cake.",false_negative
1,It's always so charming when a stranger comes up to you without saying anything and dry humps you from behind on the dance floor.,xxruruxx,TwoXChromosomes,3,3,0,2014-08,2014-08-02 22:34:31,"I had some guy grab my butt at the bar and I turned around and yelled ""That is NOT O.K!"" (I couldn't think of anything better to say at the time). He told me I should take it as a compliment. Thanks, but no thanks.","I had some guy grab my butt at the bar and I turned around and yelled ""That is NOT O.K!"" (I couldn't think of anything better to say at the time). He told me I should take it as a compliment. Thanks, but no thanks.[SEP]It's always so charming when a stranger comes up to you without saying anything and dry humps you from behind on the dance floor.",false_negative
1,"Yeah, narcissism is so hot.",Alexxis_,iamverysmart,1,1,0,2015-09,2015-09-05 05:46:14,The Onion isn't satire for this guy,"The Onion isn't satire for this guy[SEP]Yeah, narcissism is so hot.",false_negative
1,Yeah Cowboys get all the calls,The_Red_FoXXX,nfl,2,-1,-1,2016-12,2016-12-27 03:01:38,Cowboys,Cowboys[SEP]Yeah Cowboys get all the calls,false_negative
1,To me it sounds a bit pessimistic,nomansblade,NoMansSkyTheGame,1,1,0,2015-03,2015-03-07 20:37:36,One million is a tad optimistic.,One million is a tad optimistic.[SEP]To me it sounds a bit pessimistic,false_negative
1,"And then he throws an unnecessary ""s"" on ""Collins's""... this motherfucker must have lost his mind!",memetherapy,nba,1,1,0,2014-05,2014-05-28 23:59:53,I know what it means it just seems odd that he decided he couldn't type out to be fair and then proceeded to write a whole paragraph,"I know what it means it just seems odd that he decided he couldn't type out to be fair and then proceeded to write a whole paragraph[SEP]And then he throws an unnecessary ""s"" on ""Collins's""... this motherfucker must have lost his mind!",false_negative
1,Prom Queen.,IanicRR,hiphopheads,1,1,0,2013-02,2013-02-28 02:37:43,"Are there any rap songs that are on top of a electric guitar / rock n roll style vibe? I was just listening to Frank Ocean's American Wedding which is basically him singing over The Eagle's Hotel California, and I was wondering if there is anyone who has rapped over old rock n roll guitar beats or whatever they were called back then. Or just electric guitars.","Are there any rap songs that are on top of a electric guitar / rock n roll style vibe? I was just listening to Frank Ocean's American Wedding which is basically him singing over The Eagle's Hotel California, and I was wondering if there is anyone who has rapped over old rock n roll guitar beats or whatever they were called back then. Or just electric guitars.[SEP]Prom Queen.",false_negative
1,"Oh yeah, topdeck card quality has always been Jund's main weakness",WallyWendels,ModernMagic,-1,-1,0,2016-09,2016-09-09 07:53:36,"Definitely flayer. It just fixes Junds weaknesses, like not drawing into the stuff you need and feeds into its overall plan like filling the graveyard, having efficient beaters, etc. It's definitely better in Abzan, but definitely shouldn't be discounted in jund, as it's an even more 'must deal with' threat than Goyf imo, because there are situations where I don't mind getting hit by Goyf a few times.","Definitely flayer. It just fixes Junds weaknesses, like not drawing into the stuff you need and feeds into its overall plan like filling the graveyard, having efficient beaters, etc. It's definitely better in Abzan, but definitely shouldn't be discounted in jund, as it's an even more 'must deal with' threat than Goyf imo, because there are situations where I don't mind getting hit by Goyf a few times.[SEP]Oh yeah, topdeck card quality has always been Jund's main weakness",false_negative
1,If you have to ask...,Gyroisabot,Watchexchange,-8,-8,0,2015-03,2015-03-03 11:59:18,What are you asking for it?,What are you asking for it?[SEP]If you have to ask...,false_negative
1,30 min isn't that long,run4o,leagueoflegends,1,1,0,2015-09,2015-09-01 22:27:11,"It's really shitty playing on PBE, a lot of really awful players that will afk and troll. Queue times are pretty long too. Just so you don't feel as bad when you don't get an account given to you.","It's really shitty playing on PBE, a lot of really awful players that will afk and troll. Queue times are pretty long too. Just so you don't feel as bad when you don't get an account given to you.[SEP]30 min isn't that long",false_negative
1,Yeah destroying the public police assets is the best thing for the US's most violent city,DRLavigne,news,4,4,0,2015-05,2015-05-21 17:07:30,"I mean it really is. Just take your average protest/riot, equip it with hammers and crowbars, and instead of destroying random shit around the city, focus the energy on the PD HQ, cruiser fleet, and county jail.","I mean it really is. Just take your average protest/riot, equip it with hammers and crowbars, and instead of destroying random shit around the city, focus the energy on the PD HQ, cruiser fleet, and county jail.[SEP]Yeah destroying the public police assets is the best thing for the US's most violent city",false_negative
1,Because keeping 2 different brews going with the same cooldown as well as making sure you actually pick up your healing spheres is the same difficulty as the rest of the tank classes for the same reward.,winstoncurlyfries,wow,1,-1,-1,2016-10,2016-10-08 05:28:20,Skill = sit in a corner,Skill = sit in a corner[SEP]Because keeping 2 different brews going with the same cooldown as well as making sure you actually pick up your healing spheres is the same difficulty as the rest of the tank classes for the same reward.,false_negative
1,that's a flip knife stained FT i think it's around 60 dollars!,phromac,videos,1,1,0,2015-04,2015-04-09 11:58:41,That little gas station flip knife is a joke for a test. Let me run my fixed blade Buck knife at that armor and see what happens.,That little gas station flip knife is a joke for a test. Let me run my fixed blade Buck knife at that armor and see what happens.[SEP]that's a flip knife stained FT i think it's around 60 dollars!,false_negative
