label,comment,author,subreddit,score,ups,downs,date,created_utc,parent_comment,text,error
0,"Oh man, that sucks :(",Sonja_Blu,facepalm,1,-1,-1,2016-10,2016-10-04 20:27:27,"US. Nearer to Toronto now, but even when I lived down in Texas it was still ""default oil byproduct"" :/","US. Nearer to Toronto now, but even when I lived down in Texas it was still ""default oil byproduct"" :/[SEP]Oh man, that sucks :(",false_positive
0,Aaaaaand... he's got gold.,endeavourl,movies,4,4,0,2015-01,2015-01-13 18:22:45,"I get that it's easy karma, but can we just move on and stop the George lucas hate bandwagon?","I get that it's easy karma, but can we just move on and stop the George lucas hate bandwagon?[SEP]Aaaaaand... he's got gold.",false_positive
0,"the defense stat is actually garbage, just having high hp and good dps moves makes you top tier.",danhern,pokemongo,2,2,0,2016-07,2016-07-24 21:55:23,This one. Because my Weezing has better defense than a higher CP vaporeon.,"This one. Because my Weezing has better defense than a higher CP vaporeon.[SEP]the defense stat is actually garbage, just having high hp and good dps moves makes you top tier.",false_positive
0,I think I had like five or six on Oblivion ha,Crispy385,gaming,1,-1,-1,2016-12,2016-12-22 15:17:40,C'mon take a walk on the wild side. But seriously I've been replaying Skyrim and forgot how stupidly easy it is to die sometimes. So I've been re-learning the value of saving often.,C'mon take a walk on the wild side. But seriously I've been replaying Skyrim and forgot how stupidly easy it is to die sometimes. So I've been re-learning the value of saving often.[SEP]I think I had like five or six on Oblivion ha,false_positive
0,What are you talking about,jbaum517,funny,1,1,0,2014-09,2014-09-29 19:43:01,Sweet! Glad to see we're adding extera e's to words now. :),Sweet! Glad to see we're adding extera e's to words now. :)[SEP]What are you talking about,false_positive
0,that would be an inefficiency.,jabo27,politics,0,0,0,2011-03,2011-03-05 06:58:16,"I get the feeling if Defense Spending where cut, something like 9/11 might conveniently happen and all the sudden Defense Spending would suddenly be top priority.. this is just me speculating, but when you're the type of person that's all about profits and money (like a Corporation person) the welfare of people doesn't factor into the equation.","I get the feeling if Defense Spending where cut, something like 9/11 might conveniently happen and all the sudden Defense Spending would suddenly be top priority.. this is just me speculating, but when you're the type of person that's all about profits and money (like a Corporation person) the welfare of people doesn't factor into the equation.[SEP]that would be an inefficiency.",false_positive
0,This doesn't bode well.,AbsoluteFenrir,pcmasterrace,1,1,0,2015-09,2015-09-20 03:09:27,BROKEN GAMES are COMING? - FAQ Podcast,BROKEN GAMES are COMING? - FAQ Podcast[SEP]This doesn't bode well.,false_positive
0,Because sleeping in the same bed isn't consent for sex whenever he wants.,Able_Seacat_Simon,MorbidReality,14,14,0,2014-01,2014-01-11 22:22:38,"How do you get raped by your own husband? You guys share the same bed. But all the other ones are pretty disturbing, all of it is minors and family members","How do you get raped by your own husband? You guys share the same bed. But all the other ones are pretty disturbing, all of it is minors and family members[SEP]Because sleeping in the same bed isn't consent for sex whenever he wants.",false_positive
0,"Ah yes, but that final race will always be tainted by the fact that Ray Lewis killed that guy",jigielnik,formula1,2,2,0,2015-07,2015-07-31 04:37:15,And subsequently win a championship a few years later.,"And subsequently win a championship a few years later.[SEP]Ah yes, but that final race will always be tainted by the fact that Ray Lewis killed that guy",false_positive
0,"They still fish with the cormorants, they just don't make their money from the fishing anymore.",EasyChief,pics,2,2,0,2014-10,2014-10-23 22:33:39,"these are staged for photo ops, they havent fished with cormorants and lanterns in 50+ years doesnt even look like the cormorants are wearing necklaces to prevent them swallowing either","these are staged for photo ops, they havent fished with cormorants and lanterns in 50+ years doesnt even look like the cormorants are wearing necklaces to prevent them swallowing either[SEP]They still fish with the cormorants, they just don't make their money from the fishing anymore.",false_positive
0,Just what do you think the message is?,TodaysIllusion,politics,-2,-2,0,2013-08,2013-08-26 20:39:16,"So you have nothing to say about the message, you're just shooting messengers.","So you have nothing to say about the message, you're just shooting messengers.[SEP]Just what do you think the message is?",false_positive
0,I say get it.,archover,thinkpad,2,2,0,2016-08,2016-08-18 05:46:36,"Is this a good choice for a basic, reliable laptop used only for internet and word processing?","Is this a good choice for a basic, reliable laptop used only for internet and word processing?[SEP]I say get it.",false_positive
0,Kim Kardashian's butt has gained sentience.,banjowashisnameo,AskReddit,8,-1,-1,2016-11,2016-11-14 04:58:33,Kim Kardashian has found the meaning of life,Kim Kardashian has found the meaning of life[SEP]Kim Kardashian's butt has gained sentience.,false_positive
0,"Actually, Catholicism has officially recognized evolution since the 1950s.",-oligodendrocyte-,TrollXChromosomes,10,10,0,2015-09,2015-09-08 22:57:14,"Sex Ed in a Christian context can be a thing! My fiance went to a private Catholic high school in upstate New York and not only did he have the option of attending a school-taught sex ed class, but they had a priest teaching Earth science, complete with evolution!","Sex Ed in a Christian context can be a thing! My fiance went to a private Catholic high school in upstate New York and not only did he have the option of attending a school-taught sex ed class, but they had a priest teaching Earth science, complete with evolution![SEP]Actually, Catholicism has officially recognized evolution since the 1950s.",false_positive
0,My guess is Laurel breaking into his lair.,jaddeo,arrow,1,1,0,2013-11,2013-11-27 18:42:19,"So Stephen Amell just posted this, what is he looking at?!","So Stephen Amell just posted this, what is he looking at?![SEP]My guess is Laurel breaking into his lair.",false_positive
0,Its the Whiteout a tradition that goes back to the Days in Winnipeg and when the home team wore white.,pablohoney102,hockey,8,8,0,2012-05,2012-05-08 19:40:36,Can anyone explain to me why the Coyotes fans were wearing white at home? I kept thinking the whole building was supporting the Preds.,Can anyone explain to me why the Coyotes fans were wearing white at home? I kept thinking the whole building was supporting the Preds.[SEP]Its the Whiteout a tradition that goes back to the Days in Winnipeg and when the home team wore white.,false_positive
0,Oh that's right Will Grier is Nash Grier's brother FSU suddenly looks much nicer,CarterAC3,CFB,1,1,0,2015-10,2015-10-16 11:16:23,Will Grier with the long con. (Illuminati),Will Grier with the long con. (Illuminati)[SEP]Oh that's right Will Grier is Nash Grier's brother FSU suddenly looks much nicer,false_positive
0,mods.,optimates,totalwar,2,2,0,2014-10,2014-10-18 15:37:19,"How do you play as Samnites? I thought you could only play as Carthage, Rome, Syracuse, Arevaci, and the Lusitani.","How do you play as Samnites? I thought you could only play as Carthage, Rome, Syracuse, Arevaci, and the Lusitani.[SEP]mods.",false_positive
0,That's really creepy.,Drysaf,BlackPeopleTwitter,5,5,0,2015-06,2015-06-17 16:37:26,If she 15 I'm 15,If she 15 I'm 15[SEP]That's really creepy.,false_positive
0,Terpstra has a knee injury and won't ride the TdF,tic-tac-totoro,peloton,5,5,0,2016-06,2016-06-20 08:52:24,"I expect Etixx to form a very strong team for the TdF. You can bet on Dan Martin and Alaphillipe for the uphill finishes and maybe even a top-10 GC. An amazing sprinttrain in front of Kittel. I'm counting on Richeze and Trentin to be the final leadouts. The one and only pantserwagen Tony Martin for the time trails. Full this out with some of the best classic riders in the peloton, like Stybar and Terpstra, and you've get yourself one hell of a team.","I expect Etixx to form a very strong team for the TdF. You can bet on Dan Martin and Alaphillipe for the uphill finishes and maybe even a top-10 GC. An amazing sprinttrain in front of Kittel. I'm counting on Richeze and Trentin to be the final leadouts. The one and only pantserwagen Tony Martin for the time trails. Full this out with some of the best classic riders in the peloton, like Stybar and Terpstra, and you've get yourself one hell of a team.[SEP]Terpstra has a knee injury and won't ride the TdF",false_positive
0,"Yeah, but it makes you wonder what kind of life you're living when you go to a fast food burger joint looking for a healthy meal.",WERE_GOIN_IN_HARD,rantgrumps,2,2,0,2015-06,2015-06-23 07:01:40,That doesnt negate the fact that they exist.,"That doesnt negate the fact that they exist.[SEP]Yeah, but it makes you wonder what kind of life you're living when you go to a fast food burger joint looking for a healthy meal.",false_positive
0,Come save us Google Fiber!,9mac,Spokane,14,14,0,2016-08,2016-08-01 19:05:25,Washington Attorney General to Sue Comcast for $100 million. I approve this. Have never been very happy with how this company operates and/or treats its customers.,Washington Attorney General to Sue Comcast for $100 million. I approve this. Have never been very happy with how this company operates and/or treats its customers.[SEP]Come save us Google Fiber!,false_positive
0,Damn you have an up vote,zwardlaw,AskReddit,1,1,0,2016-06,2016-06-21 13:03:00,"Babies of reddit that have majored in Engineering Physics, what were the toughest obstacles to overcome?","Babies of reddit that have majored in Engineering Physics, what were the toughest obstacles to overcome?[SEP]Damn you have an up vote",false_positive
0,Short version: LA teams played in stadiums that were too big to sell out.,raf4far,nfl,3,3,0,2014-07,2014-07-21 00:23:17,"If LA is such a good market, why have so many teams left LA?","If LA is such a good market, why have so many teams left LA?[SEP]Short version: LA teams played in stadiums that were too big to sell out.",false_positive
0,"Ireland, where the #1 export is people.",inT_Splits,AskReddit,3,3,0,2015-03,2015-03-04 22:37:34,Ireland - Emigrants,"Ireland - Emigrants[SEP]Ireland, where the #1 export is people.",false_positive
0,"Yeah I think, but I'm not sure.",wireware,smashbros,1,1,0,2016-02,2016-02-03 23:12:14,2 am?,"2 am?[SEP]Yeah I think, but I'm not sure.",false_positive
0,And for the sole purpose of procreation.,tjcase10,CFB,8,8,0,2014-01,2014-01-07 06:37:30,Not until marriage it isn't,Not until marriage it isn't[SEP]And for the sole purpose of procreation.,false_positive
0,In 6's the tripmine time buff and the fact you get 2 trumps the extra GG shot.,brocyourworld,DestinyTheGame,1,1,0,2016-06,2016-06-01 17:27:15,Most top tier players don't play 6v6 or don't change their 3v3 build when they do. Everything is debatable.,Most top tier players don't play 6v6 or don't change their 3v3 build when they do. Everything is debatable.[SEP]In 6's the tripmine time buff and the fact you get 2 trumps the extra GG shot.,false_positive
0,"If only they could be skeptical of ""guy on youtube,"" but no, he just sounds so confident, that they suspend critical thinking entirely, and believe whatever they here.",Fractal_Soul,politics,28,28,0,2016-09,2016-09-26 13:53:06,Climate skeptics aren't skeptics. They assert without evidence that climate change is all a conspiracy without actually looking at any of the data.,"Climate skeptics aren't skeptics. They assert without evidence that climate change is all a conspiracy without actually looking at any of the data.[SEP]If only they could be skeptical of ""guy on youtube,"" but no, he just sounds so confident, that they suspend critical thinking entirely, and believe whatever they here.",false_positive
0,The Rainmaker holder should've just ran when they saw you Kraken.,acethunder21,splatoon,1,1,0,2016-08,2016-08-02 17:20:14,YOU SHALL NOT PASS,YOU SHALL NOT PASS[SEP]The Rainmaker holder should've just ran when they saw you Kraken.,false_positive
0,"The only coherent thought I read, one I am pretty sure you didn't mean to make, is that why should it be okay to regulate speech that instigates violence (terrorism), but not speech that instigates ignorance that can cause serious harm and death to children?",rageofheaven,worldnews,1,-1,-1,2016-10,2016-10-21 07:42:50,"So nobody cares about the obvious violation of freedom of speech? As far as im concerned posting on your own social media page is EXACTLY the same speaking to a group of your peers. Do we really want to live in a society where an administration can tell you what you can and cant talk about outside of the workplace? Simply because the latest scientific data happens not to support a conclusion, does not give any 1 or 1 million humans the authority to impose their will on another. If you disagree, then by that same logic should we not be prosecuting every religious leader and politician that promotes ideologies that spread violence, hate, and fearmongering unless it's backed by the latest science? Keeping in mind that the manipulation of the masses through systems of government and religion has resulted in countless wars raged over the history of humanity as well as the enslavement of entire populaces. Do you really want to compare the deaths or horrors of non vaccination vs war and slavery? Where's the prosecutions now? Preserving the inalienable rights of the people is more important than ""saving lives"", because once we relinquish those we lose our freedom.","So nobody cares about the obvious violation of freedom of speech? As far as im concerned posting on your own social media page is EXACTLY the same speaking to a group of your peers. Do we really want to live in a society where an administration can tell you what you can and cant talk about outside of the workplace? Simply because the latest scientific data happens not to support a conclusion, does not give any 1 or 1 million humans the authority to impose their will on another. If you disagree, then by that same logic should we not be prosecuting every religious leader and politician that promotes ideologies that spread violence, hate, and fearmongering unless it's backed by the latest science? Keeping in mind that the manipulation of the masses through systems of government and religion has resulted in countless wars raged over the history of humanity as well as the enslavement of entire populaces. Do you really want to compare the deaths or horrors of non vaccination vs war and slavery? Where's the prosecutions now? Preserving the inalienable rights of the people is more important than ""saving lives"", because once we relinquish those we lose our freedom.[SEP]The only coherent thought I read, one I am pretty sure you didn't mean to make, is that why should it be okay to regulate speech that instigates violence (terrorism), but not speech that instigates ignorance that can cause serious harm and death to children?",false_positive
0,Can it perform an action such as execute a script or run an application if the port is down?,bot-redditor,sysadmin,1,1,0,2016-06,2016-06-27 17:32:55,"If it's for just a single host then you probably don't need a heavy duty solution. [Healthstone](http://healthstone.ca) can do it for you. Just install the service on a machine with Internet access, tell it to check your host and port and either use the dashboard or have it send you a notification directly.","If it's for just a single host then you probably don't need a heavy duty solution. [Healthstone](http://healthstone.ca) can do it for you. Just install the service on a machine with Internet access, tell it to check your host and port and either use the dashboard or have it send you a notification directly.[SEP]Can it perform an action such as execute a script or run an application if the port is down?",false_positive
0,"Not even that, when he plays with his friends they insult each other as jokes.",High-RiskInsurance,GlobalOffensive,1,1,0,2015-04,2015-04-24 18:46:54,"No, you're ignorant. He is a very talented player. But toxic yes","No, you're ignorant. He is a very talented player. But toxic yes[SEP]Not even that, when he plays with his friends they insult each other as jokes.",false_positive
0,Not quite sure how to respond but I just want it to be know that I wasn't insulting inmates.,PanamaMoe,pics,1,1,0,2015-10,2015-10-11 11:26:30,I could care less. We gave the inmates chainsaws and the guy responsible for keeping them under tabs a shovel. That was never really an issue. A lot of violent inmates could do fine in a program like this. Some of the guys who did it surely committed violent crimes but only got caught for a non-violent offense. What I always noticed is that the inmates weren't really that different from me. We'd both made mistakes as teenagers. They got caught. I didn't. Their lives spiraled downward from there. Mine didn't. I got luckier than them I guess. I'm sure some folks have never done anything stupid in their life but most of these guys started going the wrong way after dumb and typical high school shit.,I could care less. We gave the inmates chainsaws and the guy responsible for keeping them under tabs a shovel. That was never really an issue. A lot of violent inmates could do fine in a program like this. Some of the guys who did it surely committed violent crimes but only got caught for a non-violent offense. What I always noticed is that the inmates weren't really that different from me. We'd both made mistakes as teenagers. They got caught. I didn't. Their lives spiraled downward from there. Mine didn't. I got luckier than them I guess. I'm sure some folks have never done anything stupid in their life but most of these guys started going the wrong way after dumb and typical high school shit.[SEP]Not quite sure how to respond but I just want it to be know that I wasn't insulting inmates.,false_positive
0,"OK, I'll get to it after I catch up on Game of Thrones.",BlackSpidy,news,7,7,0,2015-10,2015-10-15 15:16:23,The game is rigged folks. These few hundred people have the influence of nations and states . It's time for a global political revolution !,"The game is rigged folks. These few hundred people have the influence of nations and states . It's time for a global political revolution ![SEP]OK, I'll get to it after I catch up on Game of Thrones.",false_positive
0,...well then they wouldnt be coming here,TubaMuffinsOG,Seattle,6,6,0,2016-07,2016-07-10 22:43:43,High cost of living + urban congestion.,High cost of living + urban congestion.[SEP]...well then they wouldnt be coming here,false_positive
0,I bet she is going to run for public office,Cyclotrom,atheism,1,1,0,2015-09,2015-09-02 07:50:23,Kim Davis got pregnant with her third husband's twins while married to her first husband. Her second husband adopted them before she moved on to her fourth husband.,Kim Davis got pregnant with her third husband's twins while married to her first husband. Her second husband adopted them before she moved on to her fourth husband.[SEP]I bet she is going to run for public office,false_positive
0,1600 eDPI Masterrace.,HiThereImF,GlobalOffensive,4,4,0,2016-09,2016-09-02 21:27:35,"Be sure to post the end results you get, I hope this post becomes popular. I usually play on 800 DPI 2 in-game sens, only because I don't want to give money for a bigger pad, lol.","Be sure to post the end results you get, I hope this post becomes popular. I usually play on 800 DPI 2 in-game sens, only because I don't want to give money for a bigger pad, lol.[SEP]1600 eDPI Masterrace.",false_positive
0,I would advise you stop being so pedantic.,kuttanpilla,india,1,1,0,2013-10,2013-10-13 09:41:29,He has the **privilege of staying in the country** as long as he is **allowed to renew his visa**. A **visa is a privilege or an endorsement and can be revoked** at any time.,He has the **privilege of staying in the country** as long as he is **allowed to renew his visa**. A **visa is a privilege or an endorsement and can be revoked** at any time.[SEP]I would advise you stop being so pedantic.,false_positive
0,It's easier to kill people when you don't think they're people.,PhyscoticPenguin,todayilearned,1,1,0,2014-07,2014-07-26 11:13:13,"This isn't surprising in the slightest. At least in the European theater the Axis soldiers were viewed as people. Living, thinking, human beings. The Japanese were viewed as monkeys. The propaganda campaign turned them into sub-humans.","This isn't surprising in the slightest. At least in the European theater the Axis soldiers were viewed as people. Living, thinking, human beings. The Japanese were viewed as monkeys. The propaganda campaign turned them into sub-humans.[SEP]It's easier to kill people when you don't think they're people.",false_positive
0,I totally agree!,Serialfornicator,teenmom,2,-1,-1,2016-10,2016-10-12 10:52:55,"For some reason I thought BOTH of those were Ryan. I was wrong, sorry y'all, I wasn't trying shit on Ryan, just pointing out how many things could go wrong in his care. But still, he isn't a safe driver was my point, and he doesn't make Bentley wear his seat belt.","For some reason I thought BOTH of those were Ryan. I was wrong, sorry y'all, I wasn't trying shit on Ryan, just pointing out how many things could go wrong in his care. But still, he isn't a safe driver was my point, and he doesn't make Bentley wear his seat belt.[SEP]I totally agree!",false_positive
0,But at least they brought their hard hats to work.,P0rtal2,videos,2,-1,-1,2016-10,2016-10-23 08:23:11,Six-seat van carries 51 workers in China,Six-seat van carries 51 workers in China[SEP]But at least they brought their hard hats to work.,false_positive
0,"If your movement's definition of rape is ""a man existing,"" then yes, I'm sure a lot of rapists aren't tried.",Iyoten,TumblrInAction,3,3,0,2013-12,2013-12-08 08:24:55,"A girl believes Jameis Winston is still obviously guilty because ""rapists are rarely chargrd""","A girl believes Jameis Winston is still obviously guilty because ""rapists are rarely chargrd""[SEP]If your movement's definition of rape is ""a man existing,"" then yes, I'm sure a lot of rapists aren't tried.",false_positive
0,Cross dressing Reaper confirmed,IAmPsyence,Overwatch,25,25,0,2016-05,2016-05-19 07:54:08,"Well, Reaper has a soundfile in which he clearly says ""Where is Sombra, when you need her?"" - doubt it's himself he's talking about.","Well, Reaper has a soundfile in which he clearly says ""Where is Sombra, when you need her?"" - doubt it's himself he's talking about.[SEP]Cross dressing Reaper confirmed",false_positive
0,"I was, can't login into OW now.",kzakhar,Overwatch,1,1,0,2016-07,2016-07-19 18:55:44,"Anyone else just get thrown out of their game? I was in the middle of the game and then the display just cut out abruptly and left the error message ""unexpected server error occured"" , i can't log in anyone else got this problem?","Anyone else just get thrown out of their game? I was in the middle of the game and then the display just cut out abruptly and left the error message ""unexpected server error occured"" , i can't log in anyone else got this problem?[SEP]I was, can't login into OW now.",false_positive
0,"I feel most of the posts in here are, ""meh, we have been avoiding sales tax long enough, seems fair to me"".",honorface,technology,6,6,0,2013-04,2013-04-22 14:57:29,"Wait, but reddit is liberal and liberals are *for* taxes, remember?","Wait, but reddit is liberal and liberals are *for* taxes, remember?[SEP]I feel most of the posts in here are, ""meh, we have been avoiding sales tax long enough, seems fair to me"".",false_positive
0,"No matter who comes, torrent always wins.",total_bakchodi,india,0,0,0,2015-10,2015-10-23 00:39:41,"As Netflix plans on invading India, Eros stands in its way: Relationships with stars, a vast film library and a first mover advantage have impressed investors and analysts of the company.","As Netflix plans on invading India, Eros stands in its way: Relationships with stars, a vast film library and a first mover advantage have impressed investors and analysts of the company.[SEP]No matter who comes, torrent always wins.",false_positive
0,"Oh yes of course, that too, I didn't mean to be exclusive :D",falafelwaffles_,LifeProTips,1,1,0,2016-01,2016-01-12 23:07:21,uhhhhhh maybe if you're gay and attracted to men....,"uhhhhhh maybe if you're gay and attracted to men....[SEP]Oh yes of course, that too, I didn't mean to be exclusive :D",false_positive
