label,comment,author,subreddit,score,ups,downs,date,created_utc,parent_comment,text,error
0,"Not sure, only have had it like that temporarily... Maybe games on that screen wont use gpu?",ghosttr,pcmasterrace,1,1,0,2016-08,2016-08-20 22:23:19,"I have it aswell, thats why i'm asking. If it have any downsides?","I have it aswell, thats why i'm asking. If it have any downsides?[SEP]Not sure, only have had it like that temporarily... Maybe games on that screen wont use gpu?",false_positive
0,"Land of the Free, Home of the Brave.",j0n4h,politics,1,1,0,2012-07,2012-07-05 13:44:37,Video of 300 lb Cop steps on neck of a medical marijuana worker and smashes the surveillance camera's and vandalize the store,"Video of 300 lb Cop steps on neck of a medical marijuana worker and smashes the surveillance camera's and vandalize the store[SEP]Land of the Free, Home of the Brave.",false_positive
0,Neckbeard logic.,sum_dude,justneckbeardthings,3,3,0,2015-02,2015-02-05 17:58:19,"Not if you are perpetually high-fiving people, brah","Not if you are perpetually high-fiving people, brah[SEP]Neckbeard logic.",false_positive
0,There have literally been 2 answers involving Duke freshman.,SlightlyBiased,CollegeBasketball,6,6,0,2014-10,2014-10-24 05:22:46,"There are too many Duke freshmen in the answers. We don't know how good they will be. Everyone should be picking Marcus Paige from the ACC. Coach K is great, but use a coach like Smart outside of a major conference so you can use great players from the major conferences.","There are too many Duke freshmen in the answers. We don't know how good they will be. Everyone should be picking Marcus Paige from the ACC. Coach K is great, but use a coach like Smart outside of a major conference so you can use great players from the major conferences.[SEP]There have literally been 2 answers involving Duke freshman.",false_positive
0,I'm fine with not releasing the footage until after the trial as long as it can still be used as evidence.,AshThatFirstBro,news,6,6,0,2016-05,2016-05-25 19:34:13,Unsealed Arizona police video omits Officer Philip Brailsford's shooting of unarmed man Daniel Shaver,Unsealed Arizona police video omits Officer Philip Brailsford's shooting of unarmed man Daniel Shaver[SEP]I'm fine with not releasing the footage until after the trial as long as it can still be used as evidence.,false_positive
0,"But OTOH, you want a sufficiently sized population *using and owning Bitcoin*, because that makes it politically a lot harder to shut it down!",awemany,btc,2,2,0,2016-07,2016-07-06 13:54:45,This is exactly why the cost of running a Bitcoin node has to remain small - as the cost of running a node increases it becomes more and more difficult (bordering on impossible) to quietly run a node providing service to lite wallets without government detection and forced AML/KYC which would likely destroy Bitcoin. But so long as the costs are small enough that nearly anyone can operate a full node Bitcoin remains immune to such regulations.,"This is exactly why the cost of running a Bitcoin node has to remain small - as the cost of running a node increases it becomes more and more difficult (bordering on impossible) to quietly run a node providing service to lite wallets without government detection and forced AML/KYC which would likely destroy Bitcoin. But so long as the costs are small enough that nearly anyone can operate a full node Bitcoin remains immune to such regulations.[SEP]But OTOH, you want a sufficiently sized population *using and owning Bitcoin*, because that makes it politically a lot harder to shut it down!",false_positive
0,* signed Kevin Durant,robdohchannel,PoliticalDiscussion,1,-1,-1,2016-11,2016-11-09 01:14:43,Oklahoma is never a key state. - signed Texas.,Oklahoma is never a key state. - signed Texas.[SEP]* signed Kevin Durant,false_positive
0,"How is that not the same as ""shitty driving""?",majormoron,vancouver,-1,-1,0,2014-08,2014-08-17 19:13:34,Entitled to drive the way they see fit without due care for others,"Entitled to drive the way they see fit without due care for others[SEP]How is that not the same as ""shitty driving""?",false_positive
0,Hulk Hogan's daughter Brook does at least.,BioShock_Trigger,KotakuInAction,1,1,0,2015-12,2015-12-24 11:49:58,This just in women know best back to you at insanity report,This just in women know best back to you at insanity report[SEP]Hulk Hogan's daughter Brook does at least.,false_positive
0,Thanks for being a team player.,faded_moose,pics,1,-1,-1,2016-11,2016-11-01 13:38:47,Down low?,Down low?[SEP]Thanks for being a team player.,false_positive
0,"We have no way of tracking them, our best efforts are telling the reddit moderators of the problems.",echothethird,PokemonInsurgence,4,4,0,2015-04,2015-04-06 04:06:14,"ah, I see. Are you able to block them? Kinda seems unfair, to be honest.","ah, I see. Are you able to block them? Kinda seems unfair, to be honest.[SEP]We have no way of tracking them, our best efforts are telling the reddit moderators of the problems.",false_positive
0,"Says the man who sang ""bomb, bomb, bomb Iran""",monkeydeluxe,AnythingGoesNews,0,0,0,2015-01,2015-01-30 03:46:26,McCain Calls Americans 'Low-Life Scum',"McCain Calls Americans 'Low-Life Scum'[SEP]Says the man who sang ""bomb, bomb, bomb Iran""",false_positive
0,I get the impression they have seen enough to know he would be a good fit for us if he is healthy.,nohipstersallowed,Seahawks,9,9,0,2014-08,2014-08-06 20:57:24,"Yeah, but the remaining problem is if he can't play in any preseason games, he'll be hard to evaluate and therefore a risky stash on the practice squad.","Yeah, but the remaining problem is if he can't play in any preseason games, he'll be hard to evaluate and therefore a risky stash on the practice squad.[SEP]I get the impression they have seen enough to know he would be a good fit for us if he is healthy.",false_positive
0,Looks like it doesn't work :/,BlckMrkt,corgi,2,2,0,2013-11,2013-11-14 22:18:42,That's what the thing around his neck is. It inflates so he can't turn around enough to bite it. We got one for our dog but he's so skinny and agile that he could still lick his own stitches.,That's what the thing around his neck is. It inflates so he can't turn around enough to bite it. We got one for our dog but he's so skinny and agile that he could still lick his own stitches.[SEP]Looks like it doesn't work :/,false_positive
0,But I can't get a stiffy if she's ugly yo :(,NipplesOfDestiny,fffffffuuuuuuuuuuuu,1,1,0,2012-05,2012-05-09 12:47:38,"Don't be a fool. GET LAID WHILE YOU CAN. Don't look back in regret. My father told me, ""Son, don't be selfish with your body. Ugly girls need to get laid, too."" I love you, Dad.","Don't be a fool. GET LAID WHILE YOU CAN. Don't look back in regret. My father told me, ""Son, don't be selfish with your body. Ugly girls need to get laid, too."" I love you, Dad.[SEP]But I can't get a stiffy if she's ugly yo :(",false_positive
0,"Oh I hope I'm wrong, I really do.",Turduckennn,CoDCompetitive,2,2,0,2016-02,2016-02-09 19:57:39,You're in for a surprise then,"You're in for a surprise then[SEP]Oh I hope I'm wrong, I really do.",false_positive
0,My favorite part was watching Tone explode.,KysinSanawe,titanfall,12,-1,-1,2016-12,2016-12-15 18:07:42,World record for keepie-ups on a Tone?,World record for keepie-ups on a Tone?[SEP]My favorite part was watching Tone explode.,false_positive
0,Oh so tenderly.,thenonmermaid,TrollXChromosomes,11,11,0,2014-06,2014-06-10 23:52:37,"I mean, it's not like you're fellating the bottle. Are you?","I mean, it's not like you're fellating the bottle. Are you?[SEP]Oh so tenderly.",false_positive
0,The backup QB's from the 1994 Tennessee Vols team have accumulated nearly half a billion dollars from salaries alone.,jamesf797,nfl,17,17,0,2016-03,2016-03-08 18:45:22,Todd Helton checking in at number nine on that list. Peyton Manning took over for him at quarterback as a true freshman at Tennessee when Helton injured his knee. Neat.,Todd Helton checking in at number nine on that list. Peyton Manning took over for him at quarterback as a true freshman at Tennessee when Helton injured his knee. Neat.[SEP]The backup QB's from the 1994 Tennessee Vols team have accumulated nearly half a billion dollars from salaries alone.,false_positive
0,Or selling the gun he used to kill Treyvon Martin.,Elranzer,news,4,4,0,2016-07,2016-07-20 19:29:57,Almost as good a headline as George Zimmerman Selling Confederate Flag paintings at Muslim Free Gun Store,Almost as good a headline as George Zimmerman Selling Confederate Flag paintings at Muslim Free Gun Store[SEP]Or selling the gun he used to kill Treyvon Martin.,false_positive
0,hilariousandoriginal.wmv,SuperWeegee4000,pics,26,26,0,2016-03,2016-03-22 18:21:13,"Islam, the religion of peace.","Islam, the religion of peace.[SEP]hilariousandoriginal.wmv",false_positive
0,"So, your usernname.. So yeah.. Pats by 10.",BigPurp278,nfl,1,1,0,2015-09,2015-09-18 01:26:39,So who in here thinks the Patriots are beating Buffalo? I am almost certain Buffalo beats them by two scores.,"So who in here thinks the Patriots are beating Buffalo? I am almost certain Buffalo beats them by two scores.[SEP]So, your usernname.. So yeah.. Pats by 10.",false_positive
0,"If you really want to get it out there, you need to spread it on Twitter &amp; Facebook and get it trending",ResponsibleGunPwner,GunsAreCool,8,8,0,2016-09,2016-09-24 12:52:02,"American Terrorist. If you vote this up, it will show up on Google Images when people Google search American Terrorist, NRA, or the 2nd Amendment.","American Terrorist. If you vote this up, it will show up on Google Images when people Google search American Terrorist, NRA, or the 2nd Amendment.[SEP]If you really want to get it out there, you need to spread it on Twitter &amp; Facebook and get it trending",false_positive
0,Why does this sub seem to hate Tulsi?,kutwijf,politics,1,-1,-1,2016-12,2016-12-23 16:57:31,"Tulsi Gabbard talks about her new bill, Stop Arming Terrorists Act, on CNN","Tulsi Gabbard talks about her new bill, Stop Arming Terrorists Act, on CNN[SEP]Why does this sub seem to hate Tulsi?",false_positive
0,"Sid has 264 goals in his NHL career, it must get boring This is only the 22nd January 23rd of my lifetime and it barely matters to me anymore... its loses its novelty",andrewc1117,hockey,5,5,0,2014-01,2014-01-23 20:16:37,"""goal... yay?""","""goal... yay?""[SEP]Sid has 264 goals in his NHL career, it must get boring This is only the 22nd January 23rd of my lifetime and it barely matters to me anymore... its loses its novelty",false_positive
0,You could have made it believable...,Mgreen19295,MHOCStrangersBar,1,1,0,2016-01,2016-01-06 23:49:21,The Vanguard have more seats than the Greens.,The Vanguard have more seats than the Greens.[SEP]You could have made it believable...,false_positive
0,DAE wards?,classy_motherfucker,leagueoflegends,4,4,0,2012-08,2012-08-12 20:32:17,"Riot, 4 bans is due time, don't you think? I just think there's too much to ban right now, we really need 4 bans each. Please. &lt;3","Riot, 4 bans is due time, don't you think? I just think there's too much to ban right now, we really need 4 bans each. Please. &lt;3[SEP]DAE wards?",false_positive
0,You must be the unreasonable man.,xn--seorblanco-u9a,pettyrevenge,2,2,0,2015-02,2015-02-17 05:54:51,I don't bend to the world. The world bends to me.,I don't bend to the world. The world bends to me.[SEP]You must be the unreasonable man.,false_positive
0,Absolutely hilarious that anyone thinks this sub doesn't censor anything.,Mournhold,The_Donald,26,26,0,2016-06,2016-06-13 06:30:54,When everyone calls you a fascist but you're the only ones who don't censor content,When everyone calls you a fascist but you're the only ones who don't censor content[SEP]Absolutely hilarious that anyone thinks this sub doesn't censor anything.,false_positive
0,Plus Im sure theres no wait at the register and plenty of parking spots to choose from.,Paradoxfree,news,1,1,0,2016-04,2016-04-22 22:29:10,"Relived to see that the K-Mart I frequent isn't on the list. I know it's overpriced, but it's in an incredibly convenient location (in the same shopping center as my Gamestop of choice and Home Depot of Choice), and not having to deal with the Wal-Mart Crowd makes the increase in cost worth it.","Relived to see that the K-Mart I frequent isn't on the list. I know it's overpriced, but it's in an incredibly convenient location (in the same shopping center as my Gamestop of choice and Home Depot of Choice), and not having to deal with the Wal-Mart Crowd makes the increase in cost worth it.[SEP]Plus Im sure theres no wait at the register and plenty of parking spots to choose from.",false_positive
0,Time zones are difficult.,trogon,AskReddit,1,1,0,2015-09,2015-09-18 17:02:22,So why are you at home on a Friday night?,So why are you at home on a Friday night?[SEP]Time zones are difficult.,false_positive
0,Based Jeewa,aehlemn1,The_Donald,4,-1,-1,2016-11,2016-11-01 03:15:11,Podesta and Hillary tonight tweeting and accusing Trump of having a private server and communicating with Russians. Debunked already.,Podesta and Hillary tonight tweeting and accusing Trump of having a private server and communicating with Russians. Debunked already.[SEP]Based Jeewa,false_positive
0,Why the CPU/GPU combination?,markeydarkey2,pcmasterrace,4,4,0,2016-01,2016-01-17 19:40:43,PC is definitely better than consoles; GTA 5 on an i5 4690k with a 1GB GTX 750,PC is definitely better than consoles; GTA 5 on an i5 4690k with a 1GB GTX 750[SEP]Why the CPU/GPU combination?,false_positive
0,"Of course, I'll add you right now :]",pameatsbabies,ACTrade,1,1,0,2014-03,2014-03-03 23:56:21,Would you mind if I stole all of your feathers?,"Would you mind if I stole all of your feathers?[SEP]Of course, I'll add you right now :]",false_positive
0,Consolation for whoever loses ... There's always next century.,takeapictureofthat,mlb,13,-1,-1,2016-11,2016-11-03 03:24:40,2016 World Series Game 7 MLB Mega Thread,2016 World Series Game 7 MLB Mega Thread[SEP]Consolation for whoever loses ... There's always next century.,false_positive
0,I will snatch the life right out of you.,nishaft,movies,1,1,0,2014-06,2014-06-09 13:39:22,"Man on Fire is one of my favorite movies of all time, and I can't find anyone who doesn't love it :) It's absolutely proof that film critics suck :)","Man on Fire is one of my favorite movies of all time, and I can't find anyone who doesn't love it :) It's absolutely proof that film critics suck :)[SEP]I will snatch the life right out of you.",false_positive
0,Not in edh he isn't :),Drigr,magicTCG,11,11,0,2014-09,2014-09-14 21:15:12,"With all of these juicy +1/+1 counters coming out, it's a shame this guy is rotating out.","With all of these juicy +1/+1 counters coming out, it's a shame this guy is rotating out.[SEP]Not in edh he isn't :)",false_positive
0,"Kind of a weird comment but to be fair, people don't get morbidly obese in Communist Russia.",Memyselfsomeotherguy,fatpeoplestories,3,3,0,2014-04,2014-04-26 01:03:42,I blame capitalism.,"I blame capitalism.[SEP]Kind of a weird comment but to be fair, people don't get morbidly obese in Communist Russia.",false_positive
0,Iberian Peninsula is Spain/Portugal...,daintydwarf0,totalwar,2,2,0,2012-12,2012-12-20 03:39:25,"I would take a total war game set in the Middle East which includes, the Balkans, Iberian Peninsula, some of central Asia, the Caucasus mountain regions, area around the Black Sea, and extending map all the way to India. Setting would start with the death of the Prophet of Mohammed and and go to the beginning of Medieval 2 Total War.","I would take a total war game set in the Middle East which includes, the Balkans, Iberian Peninsula, some of central Asia, the Caucasus mountain regions, area around the Black Sea, and extending map all the way to India. Setting would start with the death of the Prophet of Mohammed and and go to the beginning of Medieval 2 Total War.[SEP]Iberian Peninsula is Spain/Portugal...",false_positive
0,I was adding it when you posted :),FoxBoxGames,RecruitCS,1,1,0,2015-04,2015-04-05 07:26:08,"You should probably post a portfolio of your work, next to no one will give you anything without seeing the level of graphic designer you are.","You should probably post a portfolio of your work, next to no one will give you anything without seeing the level of graphic designer you are.[SEP]I was adding it when you posted :)",false_positive
0,Would be nice if someone made a chart showing the mass shootings in each state,CrispyTech,dataisbeautiful,1,1,0,2016-04,2016-04-08 10:06:56,Casualties due to IS terror attacks around the world.,Casualties due to IS terror attacks around the world.[SEP]Would be nice if someone made a chart showing the mass shootings in each state,false_positive
0,Yes,faknodolan,australia,0,0,0,2013-03,2013-03-29 04:08:47,Should we be able to buy alcohol on Good Friday ? Having to buy alcohol the day before isn't a huge issue for me and it doesn't really cause a problem but I do find it pretty amazing in this day and age we have laws that dictate our consumption of alcohol that is completely 100% religious. What do you think ?,Should we be able to buy alcohol on Good Friday ? Having to buy alcohol the day before isn't a huge issue for me and it doesn't really cause a problem but I do find it pretty amazing in this day and age we have laws that dictate our consumption of alcohol that is completely 100% religious. What do you think ?[SEP]Yes,false_positive
0,Axiom Verge,Black_Iron_Tarkus_,AskReddit,3,3,0,2016-08,2016-08-04 13:44:23,What indie video game have you played the most?,What indie video game have you played the most?[SEP]Axiom Verge,false_positive
0,Joke candidates memorabilia doesn't increase *that* much in value.,Canada_girl,politics,1,1,0,2015-04,2015-04-23 14:31:10,Ray-Banned.. These will become rare. You'll be able to sell them at auction and get thousands.,Ray-Banned.. These will become rare. You'll be able to sell them at auction and get thousands.[SEP]Joke candidates memorabilia doesn't increase *that* much in value.,false_positive
0,I like that Finland has no red or blue parties.,CobainPatocrator,MapPorn,1,1,0,2015-01,2015-01-14 02:15:13,Voting divides in Europe,Voting divides in Europe[SEP]I like that Finland has no red or blue parties.,false_positive
0,To put your weed in*,NicolasMage69,LifeProTips,4,4,0,2016-01,2016-01-12 23:44:25,LPT: Empty Pringles can makes a great airtight bin for you car.,LPT: Empty Pringles can makes a great airtight bin for you car.[SEP]To put your weed in*,false_positive
0,"thin privilege is thinking that cakes and pies need to be ""cut"" in to ""portions""",Le_Gender_Wars,AdviceAnimals,1,1,0,2014-01,2014-01-27 18:12:22,Why not eat the entire cheesecake without cutting it,"Why not eat the entire cheesecake without cutting it[SEP]thin privilege is thinking that cakes and pies need to be ""cut"" in to ""portions""",false_positive
0,This also means gold then right?,Kharos,investing,2,2,0,2014-10,2014-10-10 18:08:17,Just a while ago this Hedge Fund manager predicted a huge decline in oil prices,Just a while ago this Hedge Fund manager predicted a huge decline in oil prices[SEP]This also means gold then right?,false_positive
0,What if you go on adventures *with* Indiana Jones?,ByzantiumBall,AskReddit,2,2,0,2016-09,2016-09-03 03:17:21,"When you don't want your significant other constantly gallivanting around the world without you, getting shot at while stealing cultural artifacts from oppressed people and probably banging any girl he gets tied up with along the way :(","When you don't want your significant other constantly gallivanting around the world without you, getting shot at while stealing cultural artifacts from oppressed people and probably banging any girl he gets tied up with along the way :([SEP]What if you go on adventures *with* Indiana Jones?",false_positive
0,"Not really, could be a new Medivh who played like 2 games vs AI.",pinkdimension,heroesofthestorm,1,1,0,2016-09,2016-09-05 14:56:47,The fact that Medivh didn't top damage sure is wrong.,"The fact that Medivh didn't top damage sure is wrong.[SEP]Not really, could be a new Medivh who played like 2 games vs AI.",false_positive
0,This is basic logic right here,Phoenixfight,CringeAnarchy,2,2,0,2015-09,2015-09-03 08:41:45,"Furries can't get cancer or diseased because they *are* diseased cancers. *Duh,* come on man.","Furries can't get cancer or diseased because they *are* diseased cancers. *Duh,* come on man.[SEP]This is basic logic right here",false_positive
0,I'm not sure that one can be a former murderer.,Emperor_of_Pruritus,AskReddit,0,0,0,2016-07,2016-07-08 05:15:34,Breaking news! A crazy man broke into a department of corrections facility and killed 15 ex murderers who were on the brink of rehabilation.,Breaking news! A crazy man broke into a department of corrections facility and killed 15 ex murderers who were on the brink of rehabilation.[SEP]I'm not sure that one can be a former murderer.,false_positive
0,I'm sure Disney is friends with people in washington...,its0nLikeDonkeyKong,Disneyland,1,1,0,2015-09,2015-09-29 01:10:37,"Well then they wouldn't give such a huge discount to begin with. Unless the govt is subsidizing the tickets, which they may.","Well then they wouldn't give such a huge discount to begin with. Unless the govt is subsidizing the tickets, which they may.[SEP]I'm sure Disney is friends with people in washington...",false_positive
0,Agreed wholeheartedly - today was not the day for experimentation,TheCeleryAbides,borussiadortmund,1,1,0,2015-10,2015-10-04 16:54:31,"Tuchel has done phenomenal this season up until today. He absolutely shit and piss the bed today. That back 4 was atrocious. Did he not see how terribly we played with Papa at RB when we played Juve? What was in your mind with this fucking lineup today? Reus on the bench to start against Bayern? I know his toe is fucked but why not rest him against Hoffenheim and Darmstadt to be ready for this match? Clearly we know this match is more important, right?","Tuchel has done phenomenal this season up until today. He absolutely shit and piss the bed today. That back 4 was atrocious. Did he not see how terribly we played with Papa at RB when we played Juve? What was in your mind with this fucking lineup today? Reus on the bench to start against Bayern? I know his toe is fucked but why not rest him against Hoffenheim and Darmstadt to be ready for this match? Clearly we know this match is more important, right?[SEP]Agreed wholeheartedly - today was not the day for experimentation",false_positive
0,this is going to be that guys facebook profile pic FOREVER,dangerevans007,pics,5,5,0,2016-01,2016-01-13 02:32:34,An officer on horseback rides through the frozen city of Omaha the morning after a pub fire,An officer on horseback rides through the frozen city of Omaha the morning after a pub fire[SEP]this is going to be that guys facebook profile pic FOREVER,false_positive
0,In before Twitter unverifies his account and suspends him.,Keiichi81,The_Donald,2,-1,-1,2016-11,2016-11-16 16:18:37,Absolutely. Think about how unfair the MSM has been to him and how they spin everything. He can't ever trust them to get his message out in tact or to cover him fairly. He can bypass them with Twitter and the MSM will be forced to cover that. It's brilliant!,Absolutely. Think about how unfair the MSM has been to him and how they spin everything. He can't ever trust them to get his message out in tact or to cover him fairly. He can bypass them with Twitter and the MSM will be forced to cover that. It's brilliant![SEP]In before Twitter unverifies his account and suspends him.,false_positive
0,smoke dude.--,Swopyx,GlobalOffensive,1,1,0,2015-11,2015-11-12 23:51:32,yeah because walking right by and running into site without moving their head is totally checking.,yeah because walking right by and running into site without moving their head is totally checking.[SEP]smoke dude.--,false_positive
0,"While on that subject, do you mind me asking how experienced RPG Maker users make their music?",xKazeSenoue,Steam,5,5,0,2015-02,2015-02-08 02:16:52,"What bothers me is when the games use ""RTP"" assets (for those not familiar with RPG Maker, the RTP is a set of graphics, music and sounds that come with the engine). Given how simple RPG Maker is to use, creating the graphics and music is by far the hardest part of making games with it, so if you skip that step your game should be freeware instead of commercial.","What bothers me is when the games use ""RTP"" assets (for those not familiar with RPG Maker, the RTP is a set of graphics, music and sounds that come with the engine). Given how simple RPG Maker is to use, creating the graphics and music is by far the hardest part of making games with it, so if you skip that step your game should be freeware instead of commercial.[SEP]While on that subject, do you mind me asking how experienced RPG Maker users make their music?",false_positive
0,"I think it's because she looks more generic in the second pic, nothing against contour though.",TheLoneGunwoman,TrollMUA,11,11,0,2014-10,2014-10-31 13:51:35,I guess I'll be *that* ~~guy~~ woman and say that I still like the original. She has a sweetness to her face that contour lady doesn't,"I guess I'll be *that* ~~guy~~ woman and say that I still like the original. She has a sweetness to her face that contour lady doesn't[SEP]I think it's because she looks more generic in the second pic, nothing against contour though.",false_positive
